{
  "app": "GridCraft",
  "brief": {
    "input_purposes": [
      "Header for the even column",
      "Header for the odd column",
      "Even number 2",
      "Even number 4",
      "Even number 6",
      "Even number 8",
      "Even number 10",
      "Even number 12",
      "Even number 14",
      "Even number 16",
      "Even number 18",
      "Even number 20",
      "Even number 22",
      "Even number 24",
      "Even number 26",
      "Even number 28",
      "Even number 30",
      "Odd number 1",
      "Odd number 3",
      "Odd number 5",
      "Odd number 7",
      "Odd number 9",
      "Odd number 11",
      "Odd number 13",
      "Odd number 15",
      "Odd number 17",
      "Odd number 19",
      "Odd number 21",
      "Odd number 23",
      "Odd number 25",
      "Odd number 27",
      "Odd number 29"
    ],
    "success": [
      "GridCraft contains a two-column layout with headers Even and Odd",
      "One column lists even numbers 2-30 and the other lists odd numbers 1-29, in ascending order"
    ]
  },
  "checks": [],
  "goal": "Create a two-column list in GridCraft containing even and odd numbers limited to 30.",
  "inputs": [
    "Even",
    "Odd",
    "2",
    "4",
    "6",
    "8",
    "10",
    "12",
    "14",
    "16",
    "18",
    "20",
    "22",
    "24",
    "26",
    "28",
    "30",
    "1",
    "3",
    "5",
    "7",
    "9",
    "11",
    "13",
    "15",
    "17",
    "19",
    "21",
    "23",
    "25",
    "27",
    "29"
  ]
}